{
  "$schema": "./catalog.schema.json",
  "version": "optimal-config-catalog-v1",
  "as_of": "2026-10-22",
  "reproduced": false,
  "benchmarked": false,
  "note": "調査資料は公式の資料を読んだだけで、ここにある構成・ワークフロー・モデルは誰も実際には動かしていない（reproduced=false、ベンチマークなし）。日本語の文字描画・口パク・Mac での所要時間も未実測。だから正解を決め打ちせず、候補を2〜3案に絞って同じ10カットで試し、数字で決める。権利の判定は法的助言ではない。",
  "generatedBy": "scripts/build-optimal-config-catalog.mjs",
  "sourceDatasets": [
    {
      "id": "workflow_registry",
      "title": "画像生成AI 全域調査一式 workflows_channels/workflow_registry.json",
      "as_of": "2026-10-22",
      "provides": "W01〜W40 の各欄"
    },
    {
      "id": "rights_risk_matrix",
      "title": "画像生成AI 全域調査一式 rights/rights_risk_matrix_ja.json",
      "as_of": "2026-10-22",
      "provides": "権利の6層（A〜F）と各モデルの危険度"
    },
    {
      "id": "open_image_models_catalog",
      "title": "画像生成AI 全域調査一式 models/open_image_models_catalog_20261022.json",
      "as_of": "2026-10-22",
      "provides": "重みの許諾の表記と公式の配布先"
    },
    {
      "id": "acceleration_catalog",
      "title": "画像生成AI 全域調査一式 acceleration_tools/catalog.json",
      "as_of": "2026-10-22",
      "provides": "高速化・低 VRAM の対応環境"
    },
    {
      "id": "video_generation_guide",
      "title": "動画生成 総合ガイド（全調査統合版）第2章・第3章・付録A",
      "as_of": "2026-10-22",
      "provides": "R01〜R18、10カット試験と記録の最小項目（p17-18）、LTX・Wan・MiniMax H3 の条件"
    }
  ],
  "runtimePlaces": [
    {
      "id": "operator-mac",
      "label": "運営者の Mac（手元）",
      "operatorOwned": true,
      "sendsDataExternally": false,
      "mediaGenerationAllowed": true
    },
    {
      "id": "operator-cuda",
      "label": "運営者の NVIDIA GPU（手元）",
      "operatorOwned": true,
      "sendsDataExternally": false,
      "mediaGenerationAllowed": true
    },
    {
      "id": "operator-rented-gpu",
      "label": "運営者が借りる GPU（使う日だけ動かし、終わったら止めて保存費を確かめる）",
      "operatorOwned": true,
      "sendsDataExternally": true,
      "mediaGenerationAllowed": true
    },
    {
      "id": "operator-service",
      "label": "運営者が契約しているサービス（ChatGPT／Codex、Grok、Google など）",
      "operatorOwned": true,
      "sendsDataExternally": true,
      "mediaGenerationAllowed": true
    },
    {
      "id": "otoshigo-hosted",
      "label": "オトシゴのサーバー（画像・動画の生成と中継はしない）",
      "operatorOwned": false,
      "sendsDataExternally": true,
      "mediaGenerationAllowed": false
    }
  ],
  "rightsLayers": [
    {
      "id": "A",
      "key": "code",
      "label": "コード",
      "question": "UI・ノード・推論コードのライセンス。これだけで重みを商用に使えるとは言えない。"
    },
    {
      "id": "B",
      "key": "weights",
      "label": "重みと全依存",
      "question": "base・LoRA・VAE・text/face encoder まで全部の許諾。本番・売上・地域の条件を別々に見る。"
    },
    {
      "id": "C",
      "key": "outputs",
      "label": "出力",
      "question": "生成物を使う・売る・公開する許諾。地域の制限が出力に及ぶものもある。"
    },
    {
      "id": "D",
      "key": "hosting",
      "label": "ホスト・再販",
      "question": "個人の制作と、API やサービスとしての提供は別の用途。"
    },
    {
      "id": "E",
      "key": "assets",
      "label": "素材と人物",
      "question": "参照画像・既存キャラ・実在人物の権利と同意。モデルの許諾とは別。"
    },
    {
      "id": "F",
      "key": "data",
      "label": "データの扱い",
      "question": "送信先・保存・学習利用。ローカルでも拡張機能の通信を確かめる。"
    }
  ],
  "videoConfigs": [
    {
      "id": "R01",
      "name": "全編を生成しない（静止画＋カメラ＋声）",
      "role": "base",
      "pdfPages": "p10",
      "summary": "解説・朗読・情報整理。静止画や図で意味が伝わり、人物が常に自然に動く必要はない。",
      "targetTraits": {
        "artStyles": [
          "flat-2d-manga",
          "anime",
          "photoreal",
          "diagram-mascot",
          "live-footage"
        ],
        "identityLocks": [
          "none",
          "mascot",
          "fixed-cast",
          "person+wardrobe"
        ],
        "motions": [
          "stills-camera"
        ]
      },
      "motionLevel": "none",
      "identityNeeds": "既存のキャラ絵や写真を使い回す。動きの一致は求めない。",
      "runtimePlaces": [
        "operator-mac",
        "operator-cuda"
      ],
      "budgetBand": "zero",
      "skillLevel": "L0-L1",
      "failureModes": [
        "動くこと自体を価値と考えて意味のない I2V を挟む",
        "単調な読み上げの量産を低コストで収益化できると決めつける",
        "静止画を数百枚手で扱う手間を費用に数えない"
      ],
      "migrateTo": [
        {
          "to": [
            "R03",
            "R09"
          ],
          "when": "静止画で説明できない動作が出たら、その部分だけ"
        },
        {
          "to": [
            "R04"
          ],
          "when": "毎回同じキャラを動かすなら rig への投資と比べる"
        }
      ]
    },
    {
      "id": "R02",
      "name": "安い雰囲気 B-roll を小型の無音 T2V で大量に試す",
      "role": "clips",
      "pdfPages": "p10",
      "summary": "抽象背景・天候・遠景など、特定の人物や商品と一致させなくてよい素材。失敗は捨てられる。",
      "targetTraits": {
        "artStyles": [
          "ai-footage",
          "photoreal"
        ],
        "identityLocks": [
          "none"
        ],
        "motions": [
          "few-clips",
          "mostly-video"
        ]
      },
      "motionLevel": "medium",
      "identityNeeds": "顔・ロゴ・細かい手作業は避ける設計にする。",
      "runtimePlaces": [
        "operator-cuda"
      ],
      "budgetBand": "low",
      "skillLevel": "L1-L2",
      "failureModes": [
        "最速の T2V 重みを I2V として使う",
        "480p の抽象背景での成功を顔の接写に一般化する",
        "8GB に収まることを 8GB で速いと読む"
      ],
      "migrateTo": [
        {
          "to": [
            "R03"
          ],
          "when": "構図や主人公を固定したくなったら"
        }
      ]
    },
    {
      "id": "R03",
      "name": "先頭画像を合格にしてから I2V（B-roll・数カット）",
      "role": "clips",
      "pdfPages": "p11",
      "summary": "1カット2〜5秒。構図・色・世界観はそろえたいが、複雑な動作までは要らない。",
      "targetTraits": {
        "artStyles": [
          "flat-2d-manga",
          "anime",
          "photoreal",
          "diagram-mascot",
          "ai-footage",
          "live-footage"
        ],
        "identityLocks": [
          "none",
          "mascot",
          "fixed-cast",
          "person+wardrobe"
        ],
        "motions": [
          "few-clips",
          "mostly-video"
        ]
      },
      "motionLevel": "low",
      "identityNeeds": "先頭画像の段階で人物・画風を固定し、動画では1動作ずつ指定する。",
      "runtimePlaces": [
        "operator-cuda",
        "operator-rented-gpu",
        "operator-service"
      ],
      "budgetBand": "medium",
      "skillLevel": "L1-L2",
      "failureModes": [
        "同じ画像でもモデルを変えると同じ動きが出るとは限らない",
        "upscale で商品や文字の正しさは直らない",
        "低解像度の試作と本生成の二重費用が削減分を上回る"
      ],
      "migrateTo": [
        {
          "to": [
            "R06"
          ],
          "when": "毎回キャラが変わり、人物の連続性が要るなら"
        }
      ]
    },
    {
      "id": "R04",
      "name": "アニメ会話劇（台詞が先、キャラ固定、必要な所だけ生成）",
      "role": "base",
      "pdfPages": "p11",
      "summary": "同じ数人が毎回話す掛け合い。台詞と話者が大事で、全身の複雑な動作は少ない。",
      "targetTraits": {
        "artStyles": [
          "flat-2d-manga",
          "anime"
        ],
        "identityLocks": [
          "fixed-cast",
          "mascot"
        ],
        "motions": [
          "stills-camera",
          "few-clips"
        ]
      },
      "motionLevel": "low",
      "identityNeeds": "設定画・表情差分・口形・背景をキャラ資産として持ち、話数で回収する。",
      "runtimePlaces": [
        "operator-mac",
        "operator-cuda"
      ],
      "budgetBand": "low",
      "skillLevel": "L1-L2",
      "failureModes": [
        "汎用の音声駆動モデルがどの2D絵にも自然な口形を出せると思う",
        "複数話者を一度に生成して話者が混ざる"
      ],
      "migrateTo": [
        {
          "to": [
            "R03"
          ],
          "when": "特別な身振りの数カットだけ動画にする"
        },
        {
          "to": [
            "R10"
          ],
          "when": "自然な芝居が必須の接写だけ、同じ音声で比べる"
        }
      ]
    },
    {
      "id": "R05",
      "name": "アニメのバトル・ダンス（動作を先に設計）",
      "role": "base",
      "pdfPages": "p11-12",
      "summary": "動きのタイミング・手足・接触・カメラが主役。画風より動きの正確さ。",
      "targetTraits": {
        "artStyles": [
          "anime",
          "flat-2d-manga"
        ],
        "identityLocks": [
          "fixed-cast",
          "mascot"
        ],
        "motions": [
          "mostly-video"
        ]
      },
      "motionLevel": "high",
      "identityNeeds": "動作リファレンス・簡易3D・ポーズ条件を先に作る。",
      "runtimePlaces": [
        "operator-cuda",
        "operator-rented-gpu"
      ],
      "budgetBand": "high",
      "skillLevel": "L2+",
      "failureModes": [
        "始点と終点を指定しても途中の接触が正しくなる保証はない",
        "人間用の motion transfer を非人間キャラや高速戦闘に使う"
      ],
      "migrateTo": [
        {
          "to": [
            "R09"
          ],
          "when": "接触が何度も破綻する部分は3Dか手付けで完成させる"
        }
      ]
    },
    {
      "id": "R06",
      "name": "実写調の連続物語（人物資産とショットの連続性を先に作る）",
      "role": "identity",
      "pdfPages": "p12",
      "summary": "同じ主人公が複数の場面に出る。顔・衣装・舞台・時間帯の連続性が大事。",
      "targetTraits": {
        "artStyles": [
          "photoreal",
          "ai-footage"
        ],
        "identityLocks": [
          "person+wardrobe",
          "fixed-cast"
        ],
        "motions": [
          "stills-camera",
          "few-clips",
          "mostly-video"
        ]
      },
      "motionLevel": "medium",
      "identityNeeds": "人物の正面・横顔、衣装、場所の基準画像とショット表を先に作る。",
      "runtimePlaces": [
        "operator-cuda",
        "operator-rented-gpu",
        "operator-service"
      ],
      "budgetBand": "medium",
      "skillLevel": "L1-L2",
      "failureModes": [
        "最良の単発を並べても同じ作品に見えるとは限らない",
        "参照対応を完全な人物固定と書く"
      ],
      "migrateTo": [
        {
          "to": [
            "R04"
          ],
          "when": "人物の一致に費用がかかりすぎるなら、rig・3D化や許可済みの自前 LoRA と比べる"
        }
      ]
    },
    {
      "id": "R07",
      "name": "猫・犬などの物語ショート（個体の特徴と単純な動作）",
      "role": "base",
      "pdfPages": "p12-13",
      "summary": "同じ動物キャラが毎回出る短い物語。毛色・模様・体型・小物を固定したい。",
      "targetTraits": {
        "artStyles": [
          "anime",
          "photoreal",
          "ai-footage"
        ],
        "identityLocks": [
          "mascot"
        ],
        "motions": [
          "few-clips",
          "mostly-video"
        ]
      },
      "motionLevel": "medium",
      "identityNeeds": "個体の設定シートと場面ごとの開始画像。人間の顔用の口パクを動物に当然のように使わない。",
      "runtimePlaces": [